<?xml version="1.0" encoding="UTF-8"?>
<StrategyList xmlns:xs="http://www.w3.org/2001/XMLSchema-instance" xs:noNamespaceSchemaLocation="http://lcsim.org/recon/tracking/seedtracker/strategybuilder/strategies.xsd">
  <!--Strategy list Autogenerated by Strategy Builder on Tue Oct 14 18:52:22 PDT 2008.-->
  <TargetDetector>sid02</TargetDetector>
  <Strategy name="AUTOGEN0_-343517849">
    <!--AUTOGEN STATISTICS: 
			Score: 680.456618113855
			Unweighted Score (num new tracks): 84
			Adjacency: 39853.0
		-->
    <!--Cutoffs-->
    <MinPT>0.2</MinPT>
    <MinHits>7</MinHits>
    <MinConfirm>1</MinConfirm>
    <MaxDCA>10.0</MaxDCA>
    <MaxZ0>10.0</MaxZ0>
    <MaxChisq>50.0</MaxChisq>
    <BadHitChisq>15.0</BadHitChisq>
    <!--Layers-->
    <Layers>
      <Layer type="Seed" layer_number="2" detector_name="TrackerBarrel" be_flag="BARREL" />
      <Layer type="Seed" layer_number="1" detector_name="TrackerBarrel" be_flag="BARREL" />
      <Layer type="Seed" layer_number="0" detector_name="TrackerBarrel" be_flag="BARREL" />
      <Layer type="Confirm" layer_number="4" detector_name="VertexBarrel" be_flag="BARREL" />
      <Layer type="Extend" layer_number="4" detector_name="TrackerBarrel" be_flag="BARREL" />
      <Layer type="Extend" layer_number="3" detector_name="TrackerBarrel" be_flag="BARREL" />
      <Layer type="Extend" layer_number="3" detector_name="VertexBarrel" be_flag="BARREL" />
      <Layer type="Extend" layer_number="2" detector_name="VertexBarrel" be_flag="BARREL" />
      <Layer type="Extend" layer_number="1" detector_name="VertexBarrel" be_flag="BARREL" />
      <Layer type="Extend" layer_number="0" detector_name="VertexBarrel" be_flag="BARREL" />
      <Layer type="Extend" layer_number="0" detector_name="VertexEndcap" be_flag="ENDCAP_NORTH" />
      <Layer type="Extend" layer_number="0" detector_name="VertexEndcap" be_flag="ENDCAP_SOUTH" />
      <Layer type="Extend" layer_number="1" detector_name="VertexEndcap" be_flag="ENDCAP_NORTH" />
      <Layer type="Extend" layer_number="1" detector_name="VertexEndcap" be_flag="ENDCAP_SOUTH" />
      <Layer type="Extend" layer_number="1" detector_name="TrackerForward" be_flag="ENDCAP_NORTH" />
      <Layer type="Extend" layer_number="1" detector_name="TrackerForward" be_flag="ENDCAP_SOUTH" />
      <Layer type="Extend" layer_number="2" detector_name="VertexEndcap" be_flag="ENDCAP_NORTH" />
      <Layer type="Extend" layer_number="2" detector_name="VertexEndcap" be_flag="ENDCAP_SOUTH" />
      <Layer type="Extend" layer_number="0" detector_name="TrackerForward" be_flag="ENDCAP_NORTH" />
      <Layer type="Extend" layer_number="0" detector_name="TrackerForward" be_flag="ENDCAP_SOUTH" />
      <Layer type="Extend" layer_number="3" detector_name="VertexEndcap" be_flag="ENDCAP_NORTH" />
      <Layer type="Extend" layer_number="3" detector_name="VertexEndcap" be_flag="ENDCAP_SOUTH" />
      <Layer type="Extend" layer_number="0" detector_name="TrackerEndcap" be_flag="ENDCAP_NORTH" />
      <Layer type="Extend" layer_number="0" detector_name="TrackerEndcap" be_flag="ENDCAP_SOUTH" />
      <Layer type="Extend" layer_number="1" detector_name="TrackerEndcap" be_flag="ENDCAP_NORTH" />
      <Layer type="Extend" layer_number="1" detector_name="TrackerEndcap" be_flag="ENDCAP_SOUTH" />
      <Layer type="Extend" layer_number="2" detector_name="TrackerEndcap" be_flag="ENDCAP_NORTH" />
      <Layer type="Extend" layer_number="2" detector_name="TrackerEndcap" be_flag="ENDCAP_SOUTH" />
      <Layer type="Extend" layer_number="3" detector_name="TrackerEndcap" be_flag="ENDCAP_NORTH" />
      <Layer type="Extend" layer_number="3" detector_name="TrackerEndcap" be_flag="ENDCAP_SOUTH" />
    </Layers>
  </Strategy>
  <Strategy name="AUTOGEN2_2057828749">
    <!--AUTOGEN STATISTICS: 
			Score: 151.70428674375714
			Unweighted Score (num new tracks): 55
			Adjacency: 4.0
		-->
    <!--Cutoffs-->
    <MinPT>0.2</MinPT>
    <MinHits>7</MinHits>
    <MinConfirm>1</MinConfirm>
    <MaxDCA>10.0</MaxDCA>
    <MaxZ0>10.0</MaxZ0>
    <MaxChisq>50.0</MaxChisq>
    <BadHitChisq>15.0</BadHitChisq>
    <!--Layers-->
    <Layers>
      <Layer type="Seed" layer_number="0" detector_name="TrackerBarrel" be_flag="BARREL" />
      <Layer type="Seed" layer_number="3" detector_name="VertexBarrel" be_flag="BARREL" />
      <Layer type="Seed" layer_number="0" detector_name="VertexBarrel" be_flag="BARREL" />
      <Layer type="Confirm" layer_number="1" detector_name="VertexBarrel" be_flag="BARREL" />
      <Layer type="Extend" layer_number="4" detector_name="TrackerBarrel" be_flag="BARREL" />
      <Layer type="Extend" layer_number="3" detector_name="TrackerBarrel" be_flag="BARREL" />
      <Layer type="Extend" layer_number="2" detector_name="TrackerBarrel" be_flag="BARREL" />
      <Layer type="Extend" layer_number="1" detector_name="TrackerBarrel" be_flag="BARREL" />
      <Layer type="Extend" layer_number="4" detector_name="VertexBarrel" be_flag="BARREL" />
      <Layer type="Extend" layer_number="2" detector_name="VertexBarrel" be_flag="BARREL" />
      <Layer type="Extend" layer_number="0" detector_name="VertexEndcap" be_flag="ENDCAP_NORTH" />
      <Layer type="Extend" layer_number="0" detector_name="VertexEndcap" be_flag="ENDCAP_SOUTH" />
      <Layer type="Extend" layer_number="1" detector_name="VertexEndcap" be_flag="ENDCAP_NORTH" />
      <Layer type="Extend" layer_number="1" detector_name="VertexEndcap" be_flag="ENDCAP_SOUTH" />
      <Layer type="Extend" layer_number="1" detector_name="TrackerForward" be_flag="ENDCAP_NORTH" />
      <Layer type="Extend" layer_number="1" detector_name="TrackerForward" be_flag="ENDCAP_SOUTH" />
      <Layer type="Extend" layer_number="2" detector_name="VertexEndcap" be_flag="ENDCAP_NORTH" />
      <Layer type="Extend" layer_number="2" detector_name="VertexEndcap" be_flag="ENDCAP_SOUTH" />
      <Layer type="Extend" layer_number="0" detector_name="TrackerForward" be_flag="ENDCAP_NORTH" />
      <Layer type="Extend" layer_number="0" detector_name="TrackerForward" be_flag="ENDCAP_SOUTH" />
      <Layer type="Extend" layer_number="3" detector_name="VertexEndcap" be_flag="ENDCAP_NORTH" />
      <Layer type="Extend" layer_number="3" detector_name="VertexEndcap" be_flag="ENDCAP_SOUTH" />
      <Layer type="Extend" layer_number="0" detector_name="TrackerEndcap" be_flag="ENDCAP_NORTH" />
      <Layer type="Extend" layer_number="0" detector_name="TrackerEndcap" be_flag="ENDCAP_SOUTH" />
      <Layer type="Extend" layer_number="1" detector_name="TrackerEndcap" be_flag="ENDCAP_NORTH" />
      <Layer type="Extend" layer_number="1" detector_name="TrackerEndcap" be_flag="ENDCAP_SOUTH" />
      <Layer type="Extend" layer_number="2" detector_name="TrackerEndcap" be_flag="ENDCAP_NORTH" />
      <Layer type="Extend" layer_number="2" detector_name="TrackerEndcap" be_flag="ENDCAP_SOUTH" />
      <Layer type="Extend" layer_number="3" detector_name="TrackerEndcap" be_flag="ENDCAP_NORTH" />
      <Layer type="Extend" layer_number="3" detector_name="TrackerEndcap" be_flag="ENDCAP_SOUTH" />
    </Layers>
  </Strategy>
  <Strategy name="AUTOGEN3_-250068071">
    <!--AUTOGEN STATISTICS: 
			Score: 64639.73946189978
			Unweighted Score (num new tracks): 15734
			Adjacency: 9.0
		-->
    <!--Cutoffs-->
    <MinPT>0.2</MinPT>
    <MinHits>7</MinHits>
    <MinConfirm>1</MinConfirm>
    <MaxDCA>10.0</MaxDCA>
    <MaxZ0>10.0</MaxZ0>
    <MaxChisq>50.0</MaxChisq>
    <BadHitChisq>15.0</BadHitChisq>
    <!--Layers-->
    <Layers>
      <Layer type="Seed" layer_number="1" detector_name="TrackerBarrel" be_flag="BARREL" />
      <Layer type="Seed" layer_number="0" detector_name="TrackerBarrel" be_flag="BARREL" />
      <Layer type="Seed" layer_number="2" detector_name="VertexBarrel" be_flag="BARREL" />
      <Layer type="Confirm" layer_number="1" detector_name="VertexBarrel" be_flag="BARREL" />
      <Layer type="Extend" layer_number="4" detector_name="TrackerBarrel" be_flag="BARREL" />
      <Layer type="Extend" layer_number="3" detector_name="TrackerBarrel" be_flag="BARREL" />
      <Layer type="Extend" layer_number="2" detector_name="TrackerBarrel" be_flag="BARREL" />
      <Layer type="Extend" layer_number="4" detector_name="VertexBarrel" be_flag="BARREL" />
      <Layer type="Extend" layer_number="3" detector_name="VertexBarrel" be_flag="BARREL" />
      <Layer type="Extend" layer_number="0" detector_name="VertexBarrel" be_flag="BARREL" />
      <Layer type="Extend" layer_number="0" detector_name="VertexEndcap" be_flag="ENDCAP_NORTH" />
      <Layer type="Extend" layer_number="0" detector_name="VertexEndcap" be_flag="ENDCAP_SOUTH" />
      <Layer type="Extend" layer_number="1" detector_name="VertexEndcap" be_flag="ENDCAP_NORTH" />
      <Layer type="Extend" layer_number="1" detector_name="VertexEndcap" be_flag="ENDCAP_SOUTH" />
      <Layer type="Extend" layer_number="2" detector_name="VertexEndcap" be_flag="ENDCAP_NORTH" />
      <Layer type="Extend" layer_number="2" detector_name="VertexEndcap" be_flag="ENDCAP_SOUTH" />
      <Layer type="Extend" layer_number="1" detector_name="TrackerForward" be_flag="ENDCAP_NORTH" />
      <Layer type="Extend" layer_number="1" detector_name="TrackerForward" be_flag="ENDCAP_SOUTH" />
      <Layer type="Extend" layer_number="0" detector_name="TrackerForward" be_flag="ENDCAP_NORTH" />
      <Layer type="Extend" layer_number="0" detector_name="TrackerForward" be_flag="ENDCAP_SOUTH" />
      <Layer type="Extend" layer_number="3" detector_name="VertexEndcap" be_flag="ENDCAP_NORTH" />
      <Layer type="Extend" layer_number="3" detector_name="VertexEndcap" be_flag="ENDCAP_SOUTH" />
      <Layer type="Extend" layer_number="0" detector_name="TrackerEndcap" be_flag="ENDCAP_NORTH" />
      <Layer type="Extend" layer_number="0" detector_name="TrackerEndcap" be_flag="ENDCAP_SOUTH" />
      <Layer type="Extend" layer_number="1" detector_name="TrackerEndcap" be_flag="ENDCAP_NORTH" />